user_id,skills
user_1,"Python, SQL, Excel, Statistics, Communication, Problem Solving"
user_2,"Python, R, Machine Learning, SQL, Communication, Tableau"
user_3,"Excel, Google Analytics, SQL, Data Visualization, Communication, Reporting"
user_4,"Programming, Data Structures, Git, Problem Solving, Collaboration"
user_5,"SQL, Excel, Python, Tableau, Statistics, Data Visualization, Problem Solving, Communication"
user_6,"User Research, Figma, Communication, Wireframing, Collaboration"
user_7,"Python, SQL, Excel, Power BI, Communication"
user_8,"Docker, Linux, Python, Scripting, Communication"
